13938	26.082546000	::1	::1	TCP	76	50051 → 51611 [SYN, ACK] Seq=0 Ack=1 Win=65535 Len=0 MSS=65475 WS=256 SACK_PERM
13939	26.082612000	::1	::1	TCP	64	51611 → 50051 [ACK] Seq=1 Ack=1 Win=65280 Len=0
13940	26.083188100	::1	::1	HTTP2	146	Magic, SETTINGS[0], WINDOW_UPDATE[0]
13941	26.083239600	::1	::1	HTTP2	110	SETTINGS[0], WINDOW_UPDATE[0]
13942	26.083268000	::1	::1	TCP	64	51611 → 50051 [ACK] Seq=83 Ack=47 Win=65280 Len=0
13943	26.083282200	::1	::1	TCP	64	50051 → 51611 [ACK] Seq=47 Ack=83 Win=65280 Len=0
13944	26.083420000	::1	::1	HTTP2	73	SETTINGS[0]
13945	26.083541300	::1	::1	HTTP2	73	SETTINGS[0]
13946	26.083570700	::1	::1	TCP	64	51611 → 50051 [ACK] Seq=92 Ack=56 Win=65280 Len=0
13947	26.083709100	::1	::1	GRPC/PB(<UNKNOWN>)	325	HEADERS[1]: POST /Calculator/Sumar, WINDOW_UPDATE[1], DATA[1] (GRPC) (PROTOBUF), WINDOW_UPDATE[0]
13948	26.083743000	::1	::1	TCP	64	50051 → 51611 [ACK] Seq=56 Ack=353 Win=65024 Len=0
13949	26.084075600	::1	::1	HTTP2	81	PING[0]
13950	26.084110300	::1	::1	TCP	64	51611 → 50051 [ACK] Seq=353 Ack=73 Win=65280 Len=0
13951	26.084196500	::1	::1	HTTP2	81	PING[0]
13952	26.084225200	::1	::1	TCP	64	50051 → 51611 [ACK] Seq=73 Ack=370 Win=65024 Len=0
13953	26.085858600	::1	::1	GRPC/PB(<UNKNOWN>)	219	HEADERS[1]: 200 OK, DATA[1] (GRPC) (PROTOBUF), HEADERS[1], WINDOW_UPDATE[0]
13954	26.085929100	::1	::1	TCP	64	51611 → 50051 [ACK] Seq=370 Ack=228 Win=65280 Len=0
13955	26.086458100	::1	::1	HTTP2	81	PING[0]
13956	26.086498000	::1	::1	TCP	64	50051 → 51611 [ACK] Seq=228 Ack=387 Win=65024 Len=0
13957	26.086628500	::1	::1	HTTP2	81	PING[0]
13958	26.086675300	::1	::1	TCP	64	51611 → 50051 [ACK] Seq=387 Ack=245 Win=65280 Len=0
13959	26.086853700	::1	::1	TCP	64	51611 → 50051 [FIN, ACK] Seq=387 Ack=245 Win=65280 Len=0
13960	26.086889700	::1	::1	TCP	64	50051 → 51611 [ACK] Seq=245 Ack=388 Win=65024 Len=0
13961	26.087010800	::1	::1	TCP	64	50051 → 51611 [FIN, ACK] Seq=245 Ack=388 Win=65024 Len=0
13962	26.087074400	::1	::1	TCP	64	51611 → 50051 [ACK] Seq=388 Ack=246 Win=65280 Len=0
